<?xml version="1.0" encoding="UTF-8"?>

<articles xsi:noNamespaceSchemaLocation="saints.xsd" xmlns:xsi="http://www.w3.org/2001/XMLSchema-instance">
	<article>
		<date important="primary">--12-06</date>
		<name lang="CS">Mikuláš</name>
		<name lang="DE" sources="0002">Nikolaus von Myra</name>
		<since>
			<century>8</century>
		</since>
		<until xsi:nil="true"/>
		<venerated>cat</venerated>
		<significant_in xsi:nil="true"/>
		<source>
			<url id="0002">
				<author xsi:nil="true"/>
				<page_title>Nikolaus von Myra</page_title>
				<web_title>Wikipedia</web_title>
				<addrese>https://de.wikipedia.org/wiki/Nikolaus_von_Myra</addrese>
				<date_visit>2016-03-21</date_visit>
				<date_citation>2016-03-21</date_citation>
			</url>
		</source>
		<source>
			<book id="0001">
				<author>
					<surname>Bláhová</surname>
					<name>Marie</name>
				</author>
				<isbn>8072770241</isbn>
				<publication_title>Historická chronologie</publication_title>
				<place_issue>Praha</place_issue>
				<publisher>LIBRI</publisher>
				<year_publication>2001</year_publication>
			</book>
		</source>
		<comment/>
	</article>
</articles>
